{
  "schema": "tdep/0.1",
  "creative_id": "abababab-abab-4aba-8aba-abababababab",
  "owner_partner_id": "bbbbbbbb-bbbb-4bbb-8bbb-bbbbbbbbbbbb",
  "valid_from": "2026-08-01T00:00:00.000Z",
  "valid_until": "2026-12-31T23:59:59.000Z",
  "license": {
    "use": "display",
    "territory": "BR"
  },
  "brand_categories": ["retail"],
  "variants": [
    {
      "variant_id": "33333333-3333-4333-8333-333333333333",
      "orientation": "portrait",
      "pixel_w": 1080,
      "pixel_h": 1920,
      "mime": "video/mp4",
      "duration_ms": 15000,
      "audio": false,
      "uri": "https://cdn.lab.totemdigital.app.br/creatives/fill-portrait.mp4",
      "sha256": "aaaaaaaaaaaaaaaaaaaaaaaaaaaaaaaaaaaaaaaaaaaaaaaaaaaaaaaaaaaaaaaa"
    },
    {
      "variant_id": "44444444-4444-4444-8444-444444444444",
      "orientation": "landscape",
      "pixel_w": 1920,
      "pixel_h": 1080,
      "mime": "video/mp4",
      "duration_ms": 15000,
      "audio": false,
      "uri": "https://cdn.lab.totemdigital.app.br/creatives/fill-landscape.mp4",
      "sha256": "bbbbbbbbbbbbbbbbbbbbbbbbbbbbbbbbbbbbbbbbbbbbbbbbbbbbbbbbbbbbbbbb"
    }
  ]
}
