{
  "schema": "tdep/0.1",
  "creative_id": "eeeeeeee-eeee-4eee-8eee-eeeeeeeeeeee",
  "owner_partner_id": "dddddddd-dddd-4ddd-8ddd-dddddddddddd",
  "valid_from": "2026-08-01T00:00:00.000Z",
  "valid_until": "2026-12-31T23:59:59.000Z",
  "license": {
    "use": "display",
    "territory": "BR",
    "takedown_url": "https://lab.totemdigital.app.br/tdep/takedown"
  },
  "brand_categories": ["retail"],
  "variants": [
    {
      "variant_id": "33333333-3333-4333-8333-333333333333",
      "orientation": "portrait",
      "pixel_w": 1080,
      "pixel_h": 1920,
      "mime": "video/mp4",
      "duration_ms": 15000,
      "audio": false,
      "uri": "https://cdn.lab.totemdigital.app.br/creatives/fill-portrait.mp4",
      "sha256": "aaaaaaaaaaaaaaaaaaaaaaaaaaaaaaaaaaaaaaaaaaaaaaaaaaaaaaaaaaaaaaaa"
    }
  ]
}
